{
  "assunto_slug": "civil-obrigacoes",
  "disciplina": "Direito Civil",
  "titulo": "Obrigações: elementos, classificação e modalidades",
  "versao": 1,
  "atualizado_em": "2026-09-01",
  "estado": "publicado",
  "incidencia": {
    "questoes": 37,
    "provas": [
      "apostila_civil_obrigacoes_1_ce",
      "apostila_civil_obrigacoes_1_multipla"
    ],
    "apurado_em": "2026-09-01"
  },
  "resumo": "Assunto de letra da lei. Das 37 questões do acervo, 30 se decidem pelo texto dos arts. 233 a 285 do Código Civil, quase sempre com uma palavra trocada: quem escolhe, quem suporta a perda, quem responde pelas perdas e danos. Guarde os artigos por eixo — dar, restituir, fazer, alternativa, indivisível, solidária — e a maior parte cai.",
  "blocos": [
    {
      "tipo": "lista",
      "id": "elementos-da-obrigacao",
      "titulo": "Os três elementos da obrigação",
      "ordenada": false,
      "itens": [
        "Subjetivo: os sujeitos, credor e devedor, determinados ou ao menos determináveis.",
        "Objetivo: a prestação, que é conduta humana de dar, fazer ou não fazer, lícita, possível e determinável.",
        "Imaterial, também chamado espiritual ou virtual: o vínculo jurídico que sujeita o devedor à prestação em favor do credor, positiva ou negativa."
      ],
      "nota": "O elemento imaterial é o que a banca costuma nomear de outro jeito — vínculo espiritual, vínculo abstrato — para ver se você reconhece a mesma coisa.",
      "questoes": [
        {
          "prova_slug": "apostila_civil_obrigacoes_1_ce",
          "numero": 1
        }
      ]
    },
    {
      "tipo": "definicao",
      "id": "schuld-e-haftung",
      "termo": "Schuld e Haftung (débito e responsabilidade)",
      "literal": false,
      "texto": "O vínculo obrigacional tem duas camadas. Schuld, ou debitum, é o dever de prestar. Haftung, ou obligatio, é a sujeição do patrimônio à execução caso a prestação não venha. Em regra andam juntas, mas podem aparecer separadas.",
      "nao_confundir_com": [
        {
          "termo": "Schuld sem Haftung",
          "texto": "Dívida de jogo: existe o dever, o pagamento espontâneo é válido e não se repete, mas o credor não pode cobrar em juízo."
        },
        {
          "termo": "Haftung sem Schuld",
          "texto": "Garantia real prestada por terceiro: o dono do bem responde com o patrimônio sem dever a prestação principal."
        }
      ],
      "questoes": [
        {
          "prova_slug": "apostila_civil_obrigacoes_1_multipla",
          "numero": 9
        }
      ]
    },
    {
      "tipo": "texto",
      "id": "fontes-das-obrigacoes",
      "titulo": "Fontes",
      "texto": "A lei é fonte de obrigações, mas não substitui nem exclui a vontade humana. Contrato, declaração unilateral de vontade e ato ilícito também geram obrigação. Cuidado com a assertiva que apresenta a lei como fonte de deveres que a vontade humana não poderia criar: é generalização falsa, porque a maior parte das obrigações do dia a dia nasce justamente de manifestação de vontade.",
      "questoes": [
        {
          "prova_slug": "apostila_civil_obrigacoes_1_ce",
          "numero": 2
        }
      ]
    },
    {
      "tipo": "texto",
      "id": "boa-fe-objetiva",
      "titulo": "Boa-fé objetiva e deveres anexos",
      "texto": "A boa-fé objetiva funciona em três frentes: interpreta o negócio, limita o exercício de direitos subjetivos e cria deveres. Os deveres anexos, laterais ou de conduta — proteção, cooperação, informação, lealdade, sigilo — existem mesmo sem cláusula que os preveja e acompanham a relação antes, durante e depois do contrato. Descumprir dever anexo, ainda que a prestação principal tenha sido cumprida, gera responsabilidade: é o que a doutrina chama de violação positiva do contrato.",
      "questoes": [
        {
          "prova_slug": "apostila_civil_obrigacoes_1_ce",
          "numero": 3
        },
        {
          "prova_slug": "apostila_civil_obrigacoes_1_ce",
          "numero": 4
        }
      ]
    },
    {
      "tipo": "tabela",
      "id": "classificacoes",
      "titulo": "Classificações que já foram cobradas",
      "colunas": [
        "Classificação",
        "O que é",
        "Exemplo do acervo"
      ],
      "linhas": [
        [
          "Principal e acessória",
          "A principal existe por si; a acessória depende dela e a segue",
          "O contrato de locação em si é obrigação principal; a fiança que o garante é acessória"
        ],
        [
          "Simples e complexa",
          "Simples tem um credor, um devedor e uma prestação; complexa multiplica sujeitos ou prestações",
          "Compra e venda, em que cada parte é ao mesmo tempo credora e devedora, é relação obrigacional complexa"
        ]
      ],
      "questoes": [
        {
          "prova_slug": "apostila_civil_obrigacoes_1_multipla",
          "numero": 7
        },
        {
          "prova_slug": "apostila_civil_obrigacoes_1_ce",
          "numero": 8
        }
      ]
    },
    {
      "tipo": "lei_seca",
      "id": "art-392",
      "titulo": "Grau de culpa conforme o contrato aproveite ou não",
      "norma": "Código Civil (Lei 10.406/2002)",
      "dispositivos": [
        {
          "rotulo": "Art. 392",
          "texto": "Nos contratos benéficos, responde por simples culpa o contratante, a quem o contrato aproveite, e por dolo aquele a quem não favoreça; nos contratos onerosos, responde cada uma das partes por culpa, salvo as exceções previstas em lei.",
          "grifo": [
            "Nos contratos benéficos",
            "nos contratos onerosos"
          ]
        }
      ],
      "comentario": "A lógica: no contrato gratuito, quem tira proveito é tratado com rigor e responde por culpa simples; quem só faz favor responde apenas se agir com dolo. No contrato oneroso, em que ambos ganham, os dois respondem por culpa.",
      "questoes": [
        {
          "prova_slug": "apostila_civil_obrigacoes_1_ce",
          "numero": 5
        },
        {
          "prova_slug": "apostila_civil_obrigacoes_1_ce",
          "numero": 6
        }
      ]
    },
    {
      "tipo": "pegadinha",
      "id": "beneficos-x-onerosos-invertidos",
      "titulo": "Art. 392 com os dois blocos trocados",
      "isca": "Nos contratos ONEROSOS responde por simples culpa quem o contrato aproveita e por dolo quem ele não favorece; nos BENÉFICOS cada parte responde por culpa.",
      "correcao": "É o contrário. Benéfico é o contrato em que uma parte aproveita e a outra só concede; oneroso é aquele em que as duas suportam ônus e por isso respondem igualmente por culpa.",
      "explicacao": "O artigo inteiro é copiado e só os rótulos mudam de lugar. Âncora: se o contrato é de favor, não se cobra do favorecedor mais do que dolo.",
      "troca": [
        "benéficos",
        "onerosos"
      ],
      "questoes": [
        {
          "prova_slug": "apostila_civil_obrigacoes_1_ce",
          "numero": 5
        }
      ]
    },
    {
      "tipo": "lei_seca",
      "id": "dar-coisa-certa",
      "titulo": "Obrigação de dar coisa certa",
      "norma": "Código Civil (Lei 10.406/2002)",
      "dispositivos": [
        {
          "rotulo": "Art. 233",
          "texto": "A obrigação de dar coisa certa abrange os acessórios dela embora não mencionados, salvo se o contrário resultar do título ou das circunstâncias do caso.",
          "grifo": [
            "abrange os acessórios dela embora não mencionados",
            "salvo"
          ]
        },
        {
          "rotulo": "Art. 234",
          "texto": "Se, no caso do artigo antecedente, a coisa se perder, sem culpa do devedor, antes da tradição, ou pendente a condição suspensiva, fica resolvida a obrigação para ambas as partes; se a perda resultar de culpa do devedor, responderá este pelo equivalente e mais perdas e danos."
        },
        {
          "rotulo": "Art. 235",
          "texto": "Deteriorada a coisa, não sendo o devedor culpado, poderá o credor resolver a obrigação, ou aceitar a coisa, abatido de seu preço o valor que perdeu.",
          "grifo": [
            "poderá o credor",
            "abatido de seu preço o valor que perdeu"
          ]
        },
        {
          "rotulo": "Art. 236",
          "texto": "Sendo culpado o devedor, poderá o credor exigir o equivalente, ou aceitar a coisa no estado em que se acha, com direito a reclamar, em um ou em outro caso, indenização das perdas e danos.",
          "grifo": [
            "com direito a reclamar, em um ou em outro caso, indenização das perdas e danos"
          ]
        },
        {
          "rotulo": "Art. 237",
          "texto": "Até a tradição pertence ao devedor a coisa, com os seus melhoramentos e acrescidos, pelos quais poderá exigir aumento no preço; se o credor não anuir, poderá o devedor resolver a obrigação.",
          "grifo": [
            "pertence ao devedor a coisa",
            "se o credor não anuir"
          ]
        }
      ],
      "comentario": "Cinco artigos, cinco questões Certo/Errado no acervo, todas com uma única palavra virada. Vale ler os cinco em sequência antes da prova.",
      "questoes": [
        {
          "prova_slug": "apostila_civil_obrigacoes_1_ce",
          "numero": 10
        },
        {
          "prova_slug": "apostila_civil_obrigacoes_1_ce",
          "numero": 11
        },
        {
          "prova_slug": "apostila_civil_obrigacoes_1_ce",
          "numero": 12
        },
        {
          "prova_slug": "apostila_civil_obrigacoes_1_ce",
          "numero": 13
        },
        {
          "prova_slug": "apostila_civil_obrigacoes_1_ce",
          "numero": 15
        }
      ]
    },
    {
      "tipo": "pegadinha",
      "id": "acessorios-invertidos",
      "titulo": "Regra e exceção do art. 233 trocadas",
      "isca": "Como regra, a obrigação de dar coisa certa NÃO abrange os acessórios, salvo se o contrário resultar do título ou das circunstâncias.",